{
  "stylekit_id": "neutral_daylight",
  "version": "0.1.0",
  "tags": ["neutral", "indoor", "day"],
  "lighting": {
    "preset": "daylight_soft",
    "intensity": 1.0
  },
  "palette": {
    "wall": "#d8d8d8",
    "floor": "#8b7d6b",
    "accent": "#4a90e2"
  },
  "skybox": "clear_day",
  "ambience": {
    "clip_id": "quiet_room",
    "volume": 0.18
  },
  "decals": [],
  "postfx": {
    "profile_id": "neutral_warm_lowcost"
  },
  "perf_overrides": {
    "allow_decals": false,
    "allow_postfx": true
  }
}
